{
  "$schema": "https://json-schema.org/draft/2020-12/schema",
  "title": "TFWS v2 Incident",
  "type": "object",
  "required": ["schema_version", "id", "status", "opened_at", "summary", "impact"],
  "properties": {
    "schema_version": { "type": "string", "enum": ["2.0"] },
    "id": { "type": "string", "pattern": "^[A-Z0-9\\-]{8,64}$" },
    "status": { "type": "string", "enum": ["investigating", "identified", "mitigated", "resolved", "false_positive"] },
    "opened_at": { "type": "string", "format": "date-time" },
    "resolved_at": { "type": "string", "format": "date-time" },
    "summary": { "type": "string", "minLength": 10 },
    "impact": {
      "type": "object",
      "required": ["severity", "scope"],
      "properties": {
        "severity": { "type": "string", "enum": ["low", "medium", "high", "critical"] },
        "scope": { "type": "array", "items": { "type": "string" } }
      },
      "additionalProperties": false
    }
  },
  "additionalProperties": false
}
